{
  "profile_id": "last-mile-platform-operations-master-profile",
  "profile_version": "1.0.0-draft",
  "profile_label": "Last Mile Multi-Tenant Control Plane",
  "boundary_statement": "This proprietary profile remains distinct from portable SSOM Core and only binds curated SSOM outputs into tenant-isolated operating surfaces.",
  "portable_core_dependency_refs": [
    "RFC-0002-SSOM-Core-Operational-Context-and-Conformance.md",
    "docs/servicenow-serving-projection-profile-v0.9.md",
    "docs/ot-cybersecurity-foundation-profile-v0.9.md",
    "docs/functional-safety-foundation-profile-v0.9.md"
  ],
  "tenant_control_planes": [
    {
      "tenant_id": "tenant-alpha",
      "region": "us-central1",
      "isolation_domain_id": "iso-us-central1-alpha",
      "allowed_projection_classes": ["current_condition_summary", "workflow_refs", "evidence_freshness", "benchmark_alert_summary"],
      "prohibited_projection_classes": ["raw_historian_samples", "high_frequency_telemetry", "raw_opcua_payloads"],
      "workflow_projection_refs": [
        "conformance/fixtures/v0.9/valid/servicenow-serving-projection-bundle-core-assets.json",
        "conformance/fixtures/v1.0/valid/servicenow-outcome-feedback-bundle.json"
      ],
      "raw_evidence_storage_allowed": false
    },
    {
      "tenant_id": "tenant-beta",
      "region": "us-east4",
      "isolation_domain_id": "iso-us-east4-beta",
      "allowed_projection_classes": ["current_condition_summary", "workflow_refs", "evidence_freshness", "benchmark_alert_summary"],
      "prohibited_projection_classes": ["raw_historian_samples", "high_frequency_telemetry", "raw_opcua_payloads"],
      "workflow_projection_refs": [
        "conformance/fixtures/v0.9/valid/servicenow-serving-projection-bundle-core-assets.json",
        "conformance/fixtures/v1.0/valid/servicenow-outcome-feedback-bundle.json"
      ],
      "raw_evidence_storage_allowed": false
    }
  ],
  "rights_and_learning_planes": [
    {
      "plane_id": "rights-plane-v1",
      "plane_kind": "rights_management",
      "scope": "tenant_admin_and_audit",
      "tenant_refs": ["tenant-alpha", "tenant-beta"],
      "allowed_training_inputs": [],
      "prohibited_training_inputs": ["raw_historian_samples", "high_frequency_telemetry", "raw_opcua_payloads", "unapproved_cross_tenant_ground_truth"],
      "approval_refs": ["approval:rights:platform-governance-2026-06-29"],
      "model_promotion_policy": "not_applicable"
    },
    {
      "plane_id": "master-learning-plane-v1",
      "plane_kind": "master_learning",
      "scope": "cross_tenant_benchmarking",
      "tenant_refs": ["tenant-alpha", "tenant-beta"],
      "allowed_training_inputs": ["policy_cleared_comparable_benchmark_features", "curated_outcome_feedback_signals"],
      "prohibited_training_inputs": ["raw_historian_samples", "high_frequency_telemetry", "raw_opcua_payloads", "unapproved_cross_tenant_ground_truth"],
      "approval_refs": ["approval:master-learning:review-board-2026-06-29"],
      "model_promotion_policy": "promotion requires governance approval, feature lineage review, and tenant-safe comparability evidence"
    }
  ],
  "workload_isolation_policies": [
    {
      "policy_id": "tenant-strict-serving",
      "isolation_level": "tenant_strict",
      "tenant_refs": ["tenant-alpha", "tenant-beta"],
      "allowed_shared_surfaces": ["none"],
      "prohibited_shared_surfaces": ["raw_historian_samples", "high_frequency_telemetry", "raw_opcua_payloads", "tenant_workflow_payloads"]
    },
    {
      "policy_id": "shared-benchmark-only",
      "isolation_level": "shared_benchmark_only",
      "tenant_refs": ["tenant-alpha", "tenant-beta"],
      "allowed_shared_surfaces": ["policy_cleared_comparable_benchmark_features", "aggregate_benchmark_scores"],
      "prohibited_shared_surfaces": ["raw_historian_samples", "high_frequency_telemetry", "raw_opcua_payloads", "tenant_identifiers_in_clear_text"]
    }
  ],
  "observability_agent_surfaces": [
    {
      "surface_id": "tenant-alpha-workflow-agent",
      "agent_type": "workflow_agent",
      "tenant_scope": "tenant-alpha",
      "exposed_data_classes": ["workflow_refs", "current_condition_summary", "evidence_freshness"],
      "prohibited_data_classes": ["raw_historian_samples", "high_frequency_telemetry", "raw_opcua_payloads"],
      "evidence_refs": ["conformance/fixtures/v1.0/valid/servicenow-outcome-feedback-bundle.json"]
    },
    {
      "surface_id": "platform-benchmark-observer",
      "agent_type": "benchmark_observer",
      "tenant_scope": "multi_tenant_shared",
      "exposed_data_classes": ["aggregate_benchmark_scores", "policy_cleared_comparable_benchmark_features"],
      "prohibited_data_classes": ["raw_historian_samples", "high_frequency_telemetry", "raw_opcua_payloads"],
      "evidence_refs": ["conformance/fixtures/v1.0/valid/ai-comparability-proof-bundle.json"]
    }
  ],
  "master_profile_bindings": [
    {
      "binding_id": "binding-tenant-alpha",
      "tenant_id": "tenant-alpha",
      "platform_profile_role": "workflow_and_benchmark_consumer",
      "ssom_profile_refs": [
        "docs/servicenow-serving-projection-profile-v0.9.md",
        "docs/ot-cybersecurity-foundation-profile-v0.9.md"
      ],
      "projection_refs": [
        "conformance/fixtures/v0.9/valid/servicenow-serving-projection-bundle-core-assets.json",
        "conformance/fixtures/v1.0/valid/servicenow-outcome-feedback-bundle.json"
      ]
    },
    {
      "binding_id": "binding-tenant-beta",
      "tenant_id": "tenant-beta",
      "platform_profile_role": "workflow_and_benchmark_consumer",
      "ssom_profile_refs": [
        "docs/servicenow-serving-projection-profile-v0.9.md",
        "docs/functional-safety-foundation-profile-v0.9.md"
      ],
      "projection_refs": [
        "conformance/fixtures/v0.9/valid/servicenow-serving-projection-bundle-core-assets.json",
        "conformance/fixtures/v1.0/valid/servicenow-outcome-feedback-bundle.json"
      ]
    }
  ],
  "governance_controls": {
    "change_control_ref": "chg:last-mile-platform-profile-v1-2026-06-29",
    "security_review_ref": "sec:last-mile-platform-profile-v1-2026-06-29",
    "data_boundary_notes": [
      "Portable SSOM Core semantics are consumed but not redefined.",
      "Cross-tenant benchmark sharing is limited to policy-cleared comparable views.",
      "Raw evidence remains outside proprietary control-plane shared surfaces."
    ]
  }
}